{
  "prototypeId": "replace-with-a-stable-prototype-id",
  "prototypeUrl": "https://example.github.io/prototype/",
  "firebase": {
    "apiKey": "replace-with-firebase-web-api-key",
    "authDomain": "replace-with-project.firebaseapp.com",
    "projectId": "replace-with-project-id",
    "appId": "replace-with-firebase-app-id"
  },
  "stateKeys": ["auth", "session", "inv", "density", "per", "rooms", "stf", "sthome", "stlist", "sthotel", "pin", "assets"]
}
